{
  "schema_version": 1,
  "context_hash": "6299ccfa709bd257e45025615da7a7e4ed2755fd94d47aea29cb814ddfd481f5",
  "hypothesis_reviews": [
    {
      "hypothesis_id": "unconfirmed-prerequisite-hypothesis",
      "disposition": "retain_unconfirmed",
      "support_refs": [
        {
          "evidence_id": 13,
          "field": "paused"
        }
      ],
      "contrary_refs": []
    }
  ],
  "impediment_refs": [
    "explicit-unpaused-requirement"
  ],
  "contradiction_refs": [],
  "missing_information_refs": [],
  "analysis_limitation_refs": [],
  "recommendation": {
    "kind": "action_proposal",
    "capability_id": "reopen-delivery-queue",
    "reason_code": "catalogue_match",
    "evidence_refs": [
      {
        "evidence_id": 13,
        "field": "paused"
      }
    ],
    "criterion_refs": [
      "operational-degradation",
      "value-loss"
    ]
  }
}
